================================================================ UC1 =============================================================================

								Created AddressBookSystems database
		    			     ****************************************

mysql> create database AddressBookSystems;
Query OK, 1 row affected (0.01 sec)

mysql> use AddressBookSystems;
Database changed
mysql> show databases;
+--------------------+
| Database           |
+--------------------+
| addressbooksystems |
| demo               |
| information_schema |
| mysql              |
| payrollservices    |
| performance_schema |
| sakila             |
| sys                |
| world              |
+--------------------+
9 rows in set (0.01 sec)

============================================================================================ UC2 =============================================================================================================

 CREATE TABLE addressBook(
    ->     id INT UNSIGNED NOT NULL AUTO_INCREMENT,
    ->     firstName VARCHAR(9) NOT NULL,
    ->     lastName VARCHAR(9) NOT NULL,
    ->     city VARCHAR(15) NOT NULL,
    ->     state VARCHAR(15) NOT NULL,
    ->     zip VARCHAR(8) NOT NULL,
    ->     phn VARCHAR(10) NOT NULL,
    ->     PRIMARY KEY (id));
Query OK, 0 rows affected (0.02 sec)

mysql>  Describe addressbook;
+-----------+--------------+------+-----+---------+----------------+
| Field     | Type         | Null | Key | Default | Extra          |
+-----------+--------------+------+-----+---------+----------------+
| id        | int unsigned | NO   | PRI | NULL    | auto_increment |
| firstName | varchar(9)   | NO   |     | NULL    |                |
| lastName  | varchar(9)   | NO   |     | NULL    |                |
| city      | varchar(15)  | NO   |     | NULL    |                |
| state     | varchar(15)  | NO   |     | NULL    |                |
| zip       | varchar(8)   | NO   |     | NULL    |                |
| phn       | varchar(10)  | NO   |     | NULL    |                |
+-----------+--------------+------+-----+---------+----------------+
7 rows in set (0.00 sec)



============================================================================================== UC3 ===================================================================================================================

                                                        Ability to insert new contacts to address book
                                                       *************************************************

 mysql>  INSERT INTO addressbook(FirstName,LastName,City,State,Zip,Phn)  VALUES
     ->                                                 ('Tom','John','Bangalore','Karnataka','123456','9876544357'),
     ->                                                 ('Anna','Ben','kochi','Kerala','67900456','9234512376'),
     ->                                                 ('Veena','Madhav','Thrissur','Kerala','67100101','7170512376'),
     ->                                                 ('Ravi','Varma','Trivandrum','Kerala','67900151','870512376'),
     ->                                                 ('John','Samuel','Mysore','Karnataka','4557688','5643427919');
 Query OK, 5 rows affected (0.01 sec)
 Records: 5  Duplicates: 0  Warnings: 0


 mysql> SELECT * FROM addressBook;
 +----+-----------+----------+------------+-----------+----------+------------+
 | id | firstName | lastName | city       | state     | zip      | phn        |
 +----+-----------+----------+------------+-----------+----------+------------+
 |  1 | Tom       | John     | Bangalore  | Karnataka | 123456   | 9876544357 |
 |  2 | Anna      | Ben      | kochi      | Kerala    | 67900456 | 9234512376 |
 |  3 | Veena     | Madhav   | Thrissur   | Kerala    | 67100101 | 7170512376 |
 |  4 | Ravi      | Varma    | Trivandrum | Kerala    | 67900151 | 870512376  |
 |  5 | John      | Samuel   | Mysore     | Karnataka | 4557688  | 5643427919 |
 +----+-----------+----------+------------+-----------+----------+------------+
 5 rows in set (0.01 sec)


 ================================================================================ UC4 =============================================================================================================

                                                                    Update Contact
                                                                  ******************

mysql> update addressbook set city ='Bangalore' where firstName = 'John';
Query OK, 1 row affected (0.01 sec)
Rows matched: 1  Changed: 1  Warnings: 0

mysql> SELECT * FROM addressBook;
+----+-----------+----------+------------+-----------+----------+------------+
| id | firstName | lastName | city       | state     | zip      | phn        |
+----+-----------+----------+------------+-----------+----------+------------+
|  1 | Tom       | John     | Bangalore  | Karnataka | 123456   | 9876544357 |
|  2 | Anna      | Ben      | kochi      | Kerala    | 67900456 | 9234512376 |
|  3 | Veena     | Madhav   | Thrissur   | Kerala    | 67100101 | 7170512376 |
|  4 | Ravi      | Varma    | Trivandrum | Kerala    | 67900151 | 870512376  |
|  5 | John      | Samuel   | Bangalore  | Karnataka | 4557688  | 5643427919 |
+----+-----------+----------+------------+-----------+----------+------------+
5 rows in set (0.00 sec)


=========================================================================== UC5 =====================================================================================================================

                                                            DELETE CONTACT
                                                           ****************

 mysql> DELETE FROM addressbook  where firstName = 'Ravi';
 Query OK, 1 row affected (0.01 sec)

 mysql> SELECT * FROM addressBook;
 +----+-----------+----------+-----------+-----------+----------+------------+
 | id | firstName | lastName | city      | state     | zip      | phn        |
 +----+-----------+----------+-----------+-----------+----------+------------+
 |  1 | Tom       | John     | Bangalore | Karnataka | 123456   | 9876544357 |
 |  2 | Anna      | Ben      | kochi     | Kerala    | 67900456 | 9234512376 |
 |  3 | Veena     | Madhav   | Thrissur  | Kerala    | 67100101 | 7170512376 |
 |  5 | John      | Samuel   | Bangalore | Karnataka | 4557688  | 5643427919 |
 +----+-----------+----------+-----------+-----------+----------+------------+
 4 rows in set (0.00 sec)


======================================================================== UC6 =====================================================================

                                        Ability to Retrieve Person belonging to a City or State from the Address Book
                                      *********************************************************************************

mysql> Select firstName from addressbook where city = 'Kochi';
+-----------+
| firstName |
+-----------+
| Anna      |
+-----------+
1 row in set (0.00 sec)

mysql> Select firstName from addressbook where state = 'Kerala';
+-----------+
| firstName |
+-----------+
| Anna      |
| Veena     |
+-----------+

